[
  {
    "retention_permanent_archive_terminal_closure_final_retrieval_certificate_record_id": "retention-permanent-archive-terminal-closure-final-retrieval-certificate-basic-restore-001",
    "permanent_archive_terminal_closure_final_retrieval_certificate_kind": "retention_permanent_archive_terminal_closure_final_retrieval_certificate",
    "created_time": "2026-01-01T00:15:23Z",
    "node_id": "formal-rollup-node-example",
    "retention_permanent_archive_terminal_closure_final_availability_certificate_closeout_record_id": "retention-permanent-archive-terminal-closure-final-availability-certificate-closeout-basic-restore-001",
    "retention_permanent_archive_terminal_closure_final_availability_certificate_verification_receipt_id": "retention-permanent-archive-terminal-closure-final-availability-certificate-verification-basic-restore-001",
    "permanent_archive_terminal_closure_final_retrieval_certificate_state": "certified",
    "permanent_archive_terminal_closure_final_retrieval_certificate_scope": "closed_retention_permanent_archive_terminal_closure_final_availability_certificate",
    "permanent_archive_terminal_closure_final_retrieval_certificate_refs": [
      "retention-permanent-archive-terminal-closure-final-availability-certificate-closeout-basic-restore-001",
      "retention-permanent-archive-terminal-closure-final-availability-certificate-verification-basic-restore-001",
      "retention-permanent-archive-terminal-closure-final-availability-certificate-basic-restore-001",
      "retention/retention-policy.json"
    ],
    "subject_refs": [
      "retention-permanent-archive-terminal-closure-final-summary-basic-restore-001",
      "retention-permanent-archive-terminal-closure-rollup-report-closeout-basic-restore-001",
      "retention-permanent-archive-terminal-authority-release-receipt-closeout-basic-restore-001"
    ],
    "basis_refs": [
      "retention-permanent-archive-terminal-closure-final-availability-certificate-closeout-basic-restore-001",
      "retention-permanent-archive-terminal-closure-final-availability-certificate-verification-basic-restore-001",
      "retention-permanent-archive-terminal-closure-final-availability-certificate-basic-restore-001",
      "retention/retention-policy.json"
    ],
    "digest_algorithm": "sha256-sorted-retention-permanent-archive-terminal-closure-final-retrieval-certificate-ref-list",
    "permanent_archive_terminal_closure_final_retrieval_certificate_ref_digest": "010c8ac75b410a7f09148eef1b9edcb218a94d8f5edfca280e0e2bb4c95fed8a",
    "permanent_archive_terminal_closure_final_retrieval_certificate_by_ref": "tools/pfem_retention_permanent_archive_terminal_closure_final_retrieval_certificate_records.py",
    "summary": "Synthetic example retention permanent archive terminal closure final retrieval certificate record built from the closed retention permanent archive terminal closure final availability certificate path."
  }
]
